{
  "$schema": "../schemas/voice-profile.schema.json",
  "id": "reference-female",
  "name": "日語女聲參考（待核對）",
  "engines": ["cosyvoice", "breeze"],
  "status": "WAITING",
  "metadata": {
    "review_status": "WAITING",
    "manual_review_required": true,
    "source": "dataset/reference-voices/README.md",
    "notes": "JVNV 日語測試樣本；中文合成可能帶日語發音，reference transcript 尚待人工逐字核對。"
  },
  "references": {
    "cosyvoice": {
      "audio_path": "dataset/reference-voices/voice-female-f1.wav",
      "text_path": "tools/fixtures/cosyvoice/reference-female-text.txt",
      "metadata_status": "WAITING",
      "notes": "CosyVoice2 zero-shot reference；prompt text 尚待人工核對。"
    },
    "breeze": {
      "audio_path": "dataset/reference-voices/voice-female-f1.wav",
      "text_path": "tools/fixtures/breeze-reference-female-text.txt",
      "metadata_status": "DRAFT",
      "notes": "Breeze reference transcript 是 draft，禁止當作 verified metadata。"
    }
  }
}
